{
  "schema_version": "1.0",
  "approval_id": "approval_001",
  "execution_id": "exec_001",
  "action_id": "act_001",
  "request_hash": "sha256:req",
  "status": "pending",
  "approval_scope": {
    "tool_name": "deploy.production",
    "capability_class": "L2",
    "environment": "prod",
    "safe_summary": "Deploy approved release to production."
  },
  "approver_identity": null,
  "decision_reason": null,
  "policy_provenance": {
    "bundle_id": "bundle_001",
    "version": "0.2.0",
    "policy_hash": "sha256:abc",
    "environment": "prod",
    "signer_identity": "policy-admin",
    "activated_at": "2026-06-28T00:00:00Z"
  },
  "created_at": "2026-06-28T00:00:00Z",
  "expires_at": "2026-06-28T01:00:00Z",
  "decided_at": null
}
